[{"author":[{"given":"Kaidi","family":"Kang"},{"given":"Jakob","family":"Seidlitz"},{"given":"Richard A.I.","family":"Bethlehem"},{"given":"Jiangmei","family":"Xiong"},{"given":"Megan T.","family":"Jones"},{"given":"Kahini","family":"Mehta"},{"given":"Arielle S.","family":"Keller"},{"given":"Ran","family":"Tao"},{"given":"Anita","family":"Randolph"},{"given":"Bart","family":"Larsen"},{"given":"Brenden","family":"Tervo-Clemmens"},{"given":"Eric","family":"Feczko"},{"given":"Oscar Miranda","family":"Dominguez"},{"given":"Steve","family":"Nelson"},{"given":"Jonathan","family":"Schildcrout"},{"given":"Damien","family":"Fair"},{"given":"Theodore D.","family":"Satterthwaite"},{"given":"Aaron","family":"Alexander-Bloch"},{"given":"Simon","family":"Vandekar"}],"DOI":"10.1101/2023.05.29.542742","type":"article-journal","id":"Kang_2023","citation-key":"Kang_2023","issued":{"date-parts":[[2023,5]]},"publisher":"Cold Spring Harbor Laboratory","title":"Study design features that improve effect sizes in cross-sectional and longitudinal brain-wide association studies","URL":"http://dx.doi.org/10.1101/2023.05.29.542742","_graph":[{"type":"@biblatex/text","data":" @article{Kang_2023, title={Study design features that improve effect sizes in cross-sectional and longitudinal brain-wide association studies}, url={http://dx.doi.org/10.1101/2023.05.29.542742}, DOI={10.1101/2023.05.29.542742}, publisher={Cold Spring Harbor Laboratory}, author={Kang, Kaidi and Seidlitz, Jakob and Bethlehem, Richard A.I. and Xiong, Jiangmei and Jones, Megan T. and Mehta, Kahini and Keller, Arielle S. and Tao, Ran and Randolph, Anita and Larsen, Bart and Tervo-Clemmens, Brenden and Feczko, Eric and Dominguez, Oscar Miranda and Nelson, Steve and Schildcrout, Jonathan and Fair, Damien and Satterthwaite, Theodore D. and Alexander-Bloch, Aaron and Vandekar, Simon}, year={2023}, month=may }\n"},{"type":"@biblatex/entries+list"},{"type":"@csl/list+object"}]}]