[{"author":[{"given":"Colin G.","family":"DeYoung"},{"given":"Tyler","family":"Sassenberg"},{"given":"Rany","family":"Abend"},{"given":"Timothy","family":"Allen"},{"given":"Roger","family":"Beaty"},{"given":"Mark","family":"Bellgrove"},{"given":"Scott D.","family":"Blain"},{"given":"Danilo","family":"Bzdok"},{"given":"Robert","family":"Chavez"},{"given":"Stephen A.","family":"Engel"},{"given":"Feilong","family":"Ma"},{"given":"Alex","family":"Fornito"},{"given":"Erhan","family":"Genç"},{"given":"Vina","family":"Goghari"},{"given":"Rachael","family":"Grazioplene"},{"given":"Jamie Lars","family":"Hanson"},{"given":"James V.","family":"Haxby"},{"given":"Kirsten","family":"Hilger"},{"given":"Philipp","family":"Homan"},{"given":"Keanan","family":"Joyner"},{"given":"Antonia N.","family":"Kaczkurkin"},{"given":"Robert D","family":"Latzman"},{"given":"Elizabeth A","family":"Martin"},{"given":"Luca","family":"Passamonti"},{"given":"Alan","family":"Pickering"},{"given":"Adam","family":"Safron"},{"given":"Michelle","family":"Servaas"},{"given":"Luke D.","family":"Smillie"},{"given":"R. Nathan","family":"Spreng"},{"given":"Jeggan","family":"Tiego"},{"given":"Essi","family":"Viding"},{"given":"Jan","family":"Wacker"}],"DOI":"10.31234/osf.io/sfnmk","type":"article-journal","id":"DeYoung_2022","citation-key":"DeYoung_2022","issued":{"date-parts":[[2022,6]]},"publisher":"Center for Open Science","title":"Reproducible between-person brain-behavior associations do not always require thousands of individuals","URL":"http://dx.doi.org/10.31234/osf.io/sfnmk","_graph":[{"type":"@biblatex/text","data":" @article{DeYoung_2022, title={Reproducible between-person brain-behavior associations do not always require thousands of individuals}, url={http://dx.doi.org/10.31234/osf.io/sfnmk}, DOI={10.31234/osf.io/sfnmk}, publisher={Center for Open Science}, author={DeYoung, Colin G. and Sassenberg, Tyler and Abend, Rany and Allen, Timothy and Beaty, Roger and Bellgrove, Mark and Blain, Scott D. and Bzdok, Danilo and Chavez, Robert and Engel, Stephen A. and Ma, Feilong and Fornito, Alex and Genç, Erhan and Goghari, Vina and Grazioplene, Rachael and Hanson, Jamie Lars and Haxby, James V. and Hilger, Kirsten and Homan, Philipp and Joyner, Keanan and Kaczkurkin, Antonia N. and Latzman, Robert D and Martin, Elizabeth A and Passamonti, Luca and Pickering, Alan and Safron, Adam and Servaas, Michelle and Smillie, Luke D. and Spreng, R. Nathan and Tiego, Jeggan and Viding, Essi and Wacker, Jan}, year={2022}, month=jun }\n"},{"type":"@biblatex/entries+list"},{"type":"@csl/list+object"}]}]