[{"container-title":"Nature","author":[{"given":"Scott","family":"Marek"},{"given":"Brenden","family":"Tervo-Clemmens"},{"given":"Finnegan J.","family":"Calabro"},{"given":"David F.","family":"Montez"},{"given":"Benjamin P.","family":"Kay"},{"given":"Alexander S.","family":"Hatoum"},{"given":"Meghan Rose","family":"Donohue"},{"given":"William","family":"Foran"},{"given":"Ryland L.","family":"Miller"},{"given":"Timothy J.","family":"Hendrickson"},{"given":"Stephen M.","family":"Malone"},{"given":"Sridhar","family":"Kandala"},{"given":"Eric","family":"Feczko"},{"given":"Oscar","family":"Miranda-Dominguez"},{"given":"Alice M.","family":"Graham"},{"given":"Eric A.","family":"Earl"},{"given":"Anders J.","family":"Perrone"},{"given":"Michaela","family":"Cordova"},{"given":"Olivia","family":"Doyle"},{"given":"Lucille A.","family":"Moore"},{"given":"Gregory M.","family":"Conan"},{"given":"Johnny","family":"Uriarte"},{"given":"Kathy","family":"Snider"},{"given":"Benjamin J.","family":"Lynch"},{"given":"James C.","family":"Wilgenbusch"},{"given":"Thomas","family":"Pengo"},{"given":"Angela","family":"Tam"},{"given":"Jianzhong","family":"Chen"},{"given":"Dillan J.","family":"Newbold"},{"given":"Annie","family":"Zheng"},{"given":"Nicole A.","family":"Seider"},{"given":"Andrew N.","family":"Van"},{"given":"Athanasia","family":"Metoki"},{"given":"Roselyne J.","family":"Chauvin"},{"given":"Timothy O.","family":"Laumann"},{"given":"Deanna J.","family":"Greene"},{"given":"Steven E.","family":"Petersen"},{"given":"Hugh","family":"Garavan"},{"given":"Wesley K.","family":"Thompson"},{"given":"Thomas E.","family":"Nichols"},{"given":"B. T. Thomas","family":"Yeo"},{"given":"Deanna M.","family":"Barch"},{"given":"Beatriz","family":"Luna"},{"given":"Damien A.","family":"Fair"},{"given":"Nico U. F.","family":"Dosenbach"}],"DOI":"10.1038/s41586-022-04492-9","type":"article-journal","id":"Marek_2022","citation-key":"Marek_2022","ISSN":"1476-4687","issue":"7902","issued":{"date-parts":[[2022,3]]},"page":"654-660","publisher":["Springer Science","Business Media LLC"],"title":"Reproducible brain-wide association studies require thousands of individuals","URL":"http://dx.doi.org/10.1038/s41586-022-04492-9","volume":"603","_graph":[{"type":"@biblatex/text","data":" @article{Marek_2022, title={Reproducible brain-wide association studies require thousands of individuals}, volume={603}, ISSN={1476-4687}, url={http://dx.doi.org/10.1038/s41586-022-04492-9}, DOI={10.1038/s41586-022-04492-9}, number={7902}, journal={Nature}, publisher={Springer Science and Business Media LLC}, author={Marek, Scott and Tervo-Clemmens, Brenden and Calabro, Finnegan J. and Montez, David F. and Kay, Benjamin P. and Hatoum, Alexander S. and Donohue, Meghan Rose and Foran, William and Miller, Ryland L. and Hendrickson, Timothy J. and Malone, Stephen M. and Kandala, Sridhar and Feczko, Eric and Miranda-Dominguez, Oscar and Graham, Alice M. and Earl, Eric A. and Perrone, Anders J. and Cordova, Michaela and Doyle, Olivia and Moore, Lucille A. and Conan, Gregory M. and Uriarte, Johnny and Snider, Kathy and Lynch, Benjamin J. and Wilgenbusch, James C. and Pengo, Thomas and Tam, Angela and Chen, Jianzhong and Newbold, Dillan J. and Zheng, Annie and Seider, Nicole A. and Van, Andrew N. and Metoki, Athanasia and Chauvin, Roselyne J. and Laumann, Timothy O. and Greene, Deanna J. and Petersen, Steven E. and Garavan, Hugh and Thompson, Wesley K. and Nichols, Thomas E. and Yeo, B. T. Thomas and Barch, Deanna M. and Luna, Beatriz and Fair, Damien A. and Dosenbach, Nico U. F.}, year={2022}, month=mar, pages={654â€“660} }\n"},{"type":"@biblatex/entries+list"},{"type":"@csl/list+object"}]}]