[{"author":[{"given":"Janik","family":"Goltermann"},{"given":"Nils R.","family":"Winter"},{"given":"Marius","family":"Gruber"},{"given":"Lukas","family":"Fisch"},{"given":"Maike","family":"Richter"},{"given":"Dominik","family":"Grotegerd"},{"given":"Katharina","family":"Dohm"},{"given":"Susanne","family":"Meinert"},{"given":"Elisabeth J.","family":"Leehr"},{"given":"Joscha","family":"Böhnlein"},{"given":"Anna","family":"Kraus"},{"given":"Katharina","family":"Thiel"},{"given":"Alexandra","family":"Winter"},{"given":"Kira","family":"Flinkenflügel"},{"given":"Ramona","family":"Leenings"},{"given":"Carlotta","family":"Barkhau"},{"given":"Jan","family":"Ernsting"},{"given":"Klaus","family":"Berger"},{"given":"Heike","family":"Minnerup"},{"given":"Benjamin","family":"Straube"},{"given":"Nina","family":"Alexander"},{"given":"Hamidreza","family":"Jamalabadi"},{"given":"Frederike","family":"Stein"},{"given":"Katharina","family":"Brosch"},{"given":"Adrian","family":"Wroblewski"},{"given":"Florian","family":"Thomas-Odenthal"},{"given":"Paula","family":"Usemann"},{"given":"Lea","family":"Teutenberg"},{"given":"Julia","family":"Pfarr"},{"given":"Andreas","family":"Jansen"},{"given":"Igor","family":"Nenadić"},{"given":"Tilo","family":"Kircher"},{"given":"Christian","family":"Gaser"},{"given":"Nils","family":"Opel"},{"given":"Tim","family":"Hahn"},{"given":"Udo","family":"Dannlowski"}],"DOI":"10.1101/2023.03.29.534696","type":"article-journal","id":"Goltermann_2023","citation-key":"Goltermann_2023","issued":{"date-parts":[[2023,3]]},"publisher":"Cold Spring Harbor Laboratory","title":"Cross-validation for the estimation of effect size generalizability in mass-univariate brain-wide association studies","URL":"http://dx.doi.org/10.1101/2023.03.29.534696","_graph":[{"type":"@biblatex/text","data":" @article{Goltermann_2023, title={Cross-validation for the estimation of effect size generalizability in mass-univariate brain-wide association studies}, url={http://dx.doi.org/10.1101/2023.03.29.534696}, DOI={10.1101/2023.03.29.534696}, publisher={Cold Spring Harbor Laboratory}, author={Goltermann, Janik and Winter, Nils R. and Gruber, Marius and Fisch, Lukas and Richter, Maike and Grotegerd, Dominik and Dohm, Katharina and Meinert, Susanne and Leehr, Elisabeth J. and Böhnlein, Joscha and Kraus, Anna and Thiel, Katharina and Winter, Alexandra and Flinkenflügel, Kira and Leenings, Ramona and Barkhau, Carlotta and Ernsting, Jan and Berger, Klaus and Minnerup, Heike and Straube, Benjamin and Alexander, Nina and Jamalabadi, Hamidreza and Stein, Frederike and Brosch, Katharina and Wroblewski, Adrian and Thomas-Odenthal, Florian and Usemann, Paula and Teutenberg, Lea and Pfarr, Julia and Jansen, Andreas and Nenadić, Igor and Kircher, Tilo and Gaser, Christian and Opel, Nils and Hahn, Tim and Dannlowski, Udo}, year={2023}, month=mar }\n"},{"type":"@biblatex/entries+list"},{"type":"@csl/list+object"}]}]